title	url	points	by	hnId	dot
Show HN: I made an app that consolidated 18 apps (doc, sheet, form, site, chat…)	https://nino.app	557	harrisonlo	38901504	digraph{"KM"->"RAG - assisted Knowledge Management";"RAG - assisted Knowledge Management"->"Contact us to access";"Contact us to access"[shape=none, label=<<a href="mailto:dev@nino.app?subject=Access%20to%20Nino%20KM">Contact us to access</a>>];}
Pocketbase: Open-source back end in one file	https://pocketbase.io/	532	dgudkov	38898934	digraph{rankdir=TB;"Open Source backend"->"SaaS"[label="for"];"Open Source backend"->"Mobile app"[label="for"];"Open Source backend"->"in 1 file";"Open Source backend"->"Realtime database";"Open Source backend"->"Authentication";"Open Source backend"->"File storage";"Open Source backend"->"Admin dashboard";"Open Source backend"->"Ready to use out of the box";"Ready to use out of the box"->"Explore all features";"Open Source backend"->"Integrate nicely with your favorite frontend stack";"Integrate nicely with your favorite frontend stack"->"Flutter";"Integrate nicely with your favorite frontend stack"->"Svelte";"Integrate nicely with your favorite frontend stack"->"Vue";"Integrate nicely with your favorite frontend stack"->"React";"Integrate nicely with your favorite frontend stack"->"Angular";"Open Source backend"->"JavaScript SDK";}
DNS Toys (2022)	https://www.dns.toys/	428	finallyy	38899290	digraph dns_toys{rankdir=TB;subgraph cluster_main{label="dns.toys Services";"World time"->"dig mumbai.time @dns.toys";"World time"->"dig newyork.time @dns.toys";"World time"->"dig paris/fr.time @dns.toys";"Timezone conversion"->"dig 2023-05-28T14:00-mumbai-paris/fr.time @dns.toys";"Weather"->"dig mumbai.weather @dns.toys";"Weather"->"dig newyork.weather @dns.toys";"Weather"->"dig amsterdam/nl.weather @dns.toys";"Unit conversion"->"dig 42km-mi.unit @dns.toys";"Unit conversion"->"dig 32GB-MB.unit @dns.toys";"Currency conversion (forex)"->"dig 100USD-INR.fx @dns.toys";"Currency conversion (forex)"->"dig 50CAD-AUD.fx @dns.toys";"IP echo"->"dig -4 ip @dns.toys";"IP echo"->"dig -6 ip @dns.toys";"Number to words"->"dig 987654321.words @dns.toys";"Usable CIDR Range"->"dig 10.0.0.0/24.cidr @dns.toys";"Usable CIDR Range"->"dig 2001:db8::/108.cidr @dns.toys";"Number base conversion"->"dig 100dec-hex.base @dns.toys";"Number base conversion"->"dig 755oct-bin.base @dns.toys";"Pi"->"dig pi @dns.toys";"Pi"->"dig pi -t txt @dns.toys";"Pi"->"dig pi -t aaaa @dns.toys";"English dictionary"->"dig fun.dict @dns.toys";"English dictionary"->"dig big - time.dict @dns.toys";"Rolling dice"->"dig 1d6.dice @dns.toys";"Rolling dice"->"dig 3d20/2.dice @dns.toys";"Tossing coin"->"dig coin @dns.toys";"Tossing coin"->"dig 2.coin @dns.toys";"Random number generation"->"dig 1 - 100.rand @dns.toys";"Random number generation"->"dig 30 - 200.rand @dns.toys";"Epoch/Unix timestamp conversion"->"dig 784783800.epoch @dns.toys";"Calculate aerial distance"->"dig A12.9352,77.6245/12.9698,77.7500.aerial @dns.toys";"Generate UUIDs"->"dig 5.uuid @dns.toys";"Help"->"dig help @dns.toys";}subgraph cluster_shortcut{label="Shortcut functions";"Bash"->"alias dy=\"dig +short @dns.toys\"";"Fish"->"alias dy=\"dig +noall +answer +additional $argv @dns.toys\"";"Zsh"->"alias dy=\"dig +short @dns.toys\"";"Bash"->"dy berlin.time";"Bash"->"dy mumbai.weather";"Bash"->"dy 100USD - INR.fx";}"Why?"->"For fun. I spend a lot of time on the terminal and doing quick unit conversions, weather checks etc. without having to open a clunky search page is useful.";}
Original Age of Empires 2 dev talks about its usage of assembly code	https://old.reddit.com/r/aoe2/comments/18ysttu/aoe_is_written_in_assembly_is_this_actually_true_o/	370	the-smug-one	38896896	digraph aoe_assembly{rankdir=LR;nodesep=0.5;subgraph cluster_reddit{label="r/aoe2 Reddit Post";bgcolor="#f0f0f0";style=rounded;post[label="AoE written in Assembly?", shape=note, style=filled, fillcolor=lightyellow];comment_matt[label="Clarification by ES_MattP (Original Dev)", shape=box, style=filled, fillcolor=lightblue];comment_other[label="Other Comments/Discussion", shape=box];post->comment_matt[label="205 Comments"];post->comment_other;subgraph cluster_details{label="Assembly Usage Details";style=rounded;bgcolor="#e0e0e0";drawing_core[label="Drawing Core (~11,500 lines)", shape=component];inline_asm[label="Inline Assembly (Optimization)", shape=component];speedup[label="~10x Sprite Drawing Speedup", shape=box];no_asm_de[label="No Assembly in DE (64-bit, Multi-threaded)", shape=box];comment_matt->drawing_core;comment_matt->inline_asm;drawing_core->speedup;comment_matt->no_asm_de;}}}
Teachable Machine (2017)	https://teachablemachine.withgoogle.com/	240	ekiauhce	38898104	digraph TeachableMachine{rankdir=TB;node[shape=box, style=filled, fillcolor=lightblue];"Teachable Machine"[label="Teachable Machine"];"What is Teachable Machine?"[label="What is Teachable Machine?"];"How do I use it?"[label="How do I use it?"];"What can I use to teach it?"[label="What can I use to teach it?"];"Tutorials"[label="Tutorials"];"Made with Teachable Machine"[label="Made with Teachable Machine"];"For Learning"[label="For Learning"];"Looking for the first version from 2017?"[label="Looking for the first version from 2017?"];"More questions?"[label="More questions?"];"Images"[label="Images"];"Sounds"[label="Sounds"];"Poses"[label="Poses"];"Pose: Head Tilt"[label="Pose: Head Tilt"];"DIY Experiment"[label="DIY Experiment"];"Assistive Communication"[label="Assistive Communication"];"Game Controller"[label="Game Controller"];"AI + Ethics"[label="AI + Ethics"];"Ready AI Lesson"[label="Ready AI Lesson"];"Teachable Machine"->"What is Teachable Machine?";"Teachable Machine"->"How do I use it?";"Teachable Machine"->"What can I use to teach it?";"Teachable Machine"->"Tutorials";"Teachable Machine"->"Made with Teachable Machine";"Teachable Machine"->"For Learning";"Teachable Machine"->"Looking for the first version from 2017?";"Teachable Machine"->"More questions?";"What can I use to teach it?"->"Images";"What can I use to teach it?"->"Sounds";"What can I use to teach it?"->"Poses";"Tutorials"->"Pose: Head Tilt";"Made with Teachable Machine"->"DIY Experiment";"Made with Teachable Machine"->"Assistive Communication";"Made with Teachable Machine"->"Game Controller";"For Learning"->"AI + Ethics";"For Learning"->"Ready AI Lesson";}
NHS to investigate Palantir influencer campaign as possible contract breach	https://goodlawproject.org/nhs-to-investigate-palantir-influencer-campaign-as-possible-contract-breach/	218	rokkitmensch	38902983	digraph{rankdir=LR;"NHS England"->"Investigation";"Palantir"->"Influencer Campaign";"Influencer Campaign"->"Target Good Law Project";"Influencer Campaign"->"Promote Contract";"Palantir"->"Failed to Seek Approval";"Investigation"->"Whether Palantir Violated Contract";"Palantir"->"Used PR & Marketing Agencies";"PR & Marketing Agencies"->"Approach Influencers";"Federated Data Platform Contract"->"Publicity and Branding Rules";"Palantir"->"Claimed Exploratory Project";"Good Law Project"->"Attacked";"Good Law Project"->"Does Work & Poses Threat";"Good Law Project"->"Needs Donations";}
GitUI	https://github.com/extrawurst/gitui	218	jethronethro	38905019	digraph GitUI{rankdir=LR;node[shape=box];"GitUI"->"Features";"GitUI"->"Motivation";"GitUI"->"Benchmarks";"GitUI"->"Roadmap";"GitUI"->"Limitations";"GitUI"->"Installation";"GitUI"->"Build";"GitUI"->"FAQs";"GitUI"->"Diagnostics";"GitUI"->"Color Theme";"GitUI"->"Key Bindings";"GitUI"->"Sponsoring";"GitUI"->"Inspiration";"GitUI"->"Contributing";"GitUI"->"Contributors";"Features"->"Fast and intuitive keyboard only control";"Features"->"Context based help";"Features"->"Inspect, commit, and amend changes";"Features"->"Stage, unstage, revert and reset files";"Features"->"Stashing";"Features"->"Push / Fetch to / from remote";"Features"->"Branch List";"Features"->"Browse / Search commit log";"Features"->"Responsive terminal UI";"Features"->"Async git API for fluid control";"Features"->"Submodule support";"Features"->"gpg commit signing";"Motivation"->"Do most git work in terminal";"Motivation"->"Use git GUIs for some cases";"Motivation"->"Git GUIs fail on giant repos";"Motivation"->"GitUI provides GUI comfort in terminal";"Benchmarks"->"Compared with lazygit and tig";"Roadmap"->"Visualize branching structure";"Roadmap"->"Interactive rebase";"Limitations"->"No sparse repo support";"Limitations"->"No git - lfs support";"Limitations"->"Credential.helper configuration";"Installation"->"Various Package Managers";"Installation"->"Release Binaries";"Installation"->"Nightly Builds";"Build"->"Requirements";"Build"->"Cargo Install";"Build"->"Cargo Features";"Inspiration"->"lazygit";"Inspiration"->"tig";"Inspiration"->"GitUp";"Inspiration"->"git - brunch";}
Irish State announce plan to build a porn preference register for most of the EU	https://www.thegist.ie/the-gist-wtf-commission/	212	cianmm	38902407	digraph G{rankdir=LR;node[shape=box, style=filled, fillcolor=lightblue];subgraph cluster_0{label="Irish State";color=blue;style=dashed;"Irish State"->"Coimisiún na Meán"[label="Announces Plan"];}subgraph cluster_1{label="Coimisiún na Meán";color=green;style=dashed;"Coimisiún na Meán"->"Plan for Age Verification"[label="Proposes"];"Plan for Age Verification"->"Requires ID and Selfie Upload"[label="Details"];"Requires ID and Selfie Upload"->"Biometric Processing"[label="Includes"];}subgraph cluster_2{label="Affected Platforms";color=red;style=dashed;"Affected Platforms"->"Porn Sites"[label="Includes"];"Affected Platforms"->"Facebook"[label="Includes"];"Affected Platforms"->"WhatsApp"[label="Includes"];"Affected Platforms"->"XTwitter"[label="Includes"];"Affected Platforms"->"YouTube"[label="Includes"];"Affected Platforms"->"Mastodon.ie"[label="Includes"];}subgraph cluster_3{label="Public Response";color=purple;style=dashed;"Public Response"->"Feedback Extension"[label="Opportunity"];"Feedback Extension"->"Email Feedback"[label="Action"];}"Coimisiún na Meán"->"Affected Platforms"[style=dotted];"Plan for Age Verification"->"Public Response"[style=dotted];}
First new VAX in 30 years? (2021)	https://mail-index.netbsd.org/port-vax/2021/07/03/msg003899.html	201	dcminter	38901012	digraph G{rankdir=LR;node[shape=box, style=filled, fillcolor=lightblue];"Port-vax Archive"->"Anders Magnusson's VAX Project";"Anders Magnusson's VAX Project"->"Initial Implementation";"Initial Implementation"->"Follow-Up Discussions";"Initial Implementation"->"EVKAA.EXE Test Pass";"Initial Implementation"->"FPGA Board Upgrade";"Initial Implementation"->"Implemented Features";"Implemented Features"->"Addressing Modes";"Implemented Features"->"Interrupt Hierarchy";"Implemented Features"->"Timers";"Implemented Features"->"151 Instructions";"Implemented Features"->"Memory Management (Future)";"Follow-Up Discussions"->"Re: First new vax in ...30 years? :-)";"Re: First new vax in ...30 years? :-)"->"Michael Parson";"Re: First new vax in ...30 years? :-)"->"Luke Brennan";"Re: First new vax in ...30 years? :-)"->"Paul Koning";"Re: First new vax in ...30 years? :-)"->"Dave McGuire";}
Carta CEO's response to the unsolicited outreach to their customers' investors	https://twitter.com/henrysward/status/1743794996732735679	198	alsodumb	38897363	digraph{rankdir=LR;"Welcome to x.com!"->"URL change";"URL change"->"Privacy & data protection settings remain the same";"Privacy & data protection settings remain the same"->"Privacy Policy: https://x.com/en/privacy";}
