title	url	points	by	hnId	dot
Anyone can push updates to the doge.gov website	https://www.404media.co/anyone-can-push-updates-to-the-doge-gov-website-2/	842	mahkeiro	43045835	digraph DOGE_Gov{rankdir=LR;node[shape=box];subgraph cluster_main{label="DOGE.gov Website Vulnerability";style=dashed; A[label="DOGE.gov Website" shape=ellipse];B[label="Insecure Database" shape=box];C[label="Anyone Can Push Updates" shape=box];D[label="Reported by Experts" shape=box];E[label="Database Entries Added" shape=box];F[label="Hastily Deployed After Elon Musk's Announcement" shape=box];}subgraph cluster_navigation{label="Website Navigation";style=dashed; G[label="Home"];H[label="About"];I[label="Support/FAQ"];J[label="Podcast"];K[label="Merch"];}subgraph cluster_follow{label="Follow Us";style=dashed;L[label="Twitter"];M[label="Bluesky"];N[label="Mastodon"];O[label="Instagram"];P[label="TikTok"];Q[label="Facebook"];}A->B;A->C;A->F;B->D;C->E;A->G;A->H;A->I;A->J;A->K;A->L;A->M;A->N;A->O;A->P;A->Q;}
Zed now predicts your next edit with Zeta, our new open model	https://zed.dev/blog/edit-prediction	460	ahamez	43045606	digraph Zed_Edit_Prediction{graph[rankdir=TB label="Zed 编辑预测功能的核心思想" labelloc=t fontsize=20];node[shape=box, style="rounded,filled", fillcolor=lightblue];Zed[label="Zed 编辑器"];EditPrediction[label="编辑预测"];Zeta[label="Zeta 模型\n(开源)"];Speed[label="速度提升\n(即时体验)"];ThoughtfulIntegration[label="周全的集成\n(Tab 键的魔法)"];LowLatency[label="低延迟\n(快速响应)"];SpeculativeDecoding[label="推测性解码"];Baseten[label="Baseten\n(模型服务)"];OpenSource[label="开源"];Zed->EditPrediction[label="引入"];EditPrediction->Zeta[label="由...驱动"];EditPrediction->Speed[label="为了"];EditPrediction->ThoughtfulIntegration[label="具有"];EditPrediction->LowLatency[label="关注"];Zeta->OpenSource[label="是"];LowLatency->SpeculativeDecoding[label="通过...实现"];LowLatency->Baseten[label="通过...实现"];Zeta->OpenSource[style=dashed, color=grey, label=""];styleLegend[shape=plaintext]styleLegend[label="图例:\n方框: 概念\n箭头: 关系"]styleLegend[fontsize=10]styleLegend[pos="0,-2"]}
AI is stifling new tech adoption?	https://vale.rocks/posts/ai-is-stifling-tech-adoption	410	kiyanwang	43047792	digraph AI_Technology_Adoption{rankdir=LR; node[shape=box, style=filled, color=lightblue, fontname="Helvetica"]; AI_Impact[label="AI Influence on Tech Adoption" shape=ellipse, color=lightgreen];Knowledge_Gap[label="The Knowledge Gap\n(Training Cutoff & Stagnant Models)" shape=ellipse, color=lightyellow];System_Prompt_Influence[label="System Prompt Influence\n(Bias Toward Specific Tech)" shape=ellipse, color=lightyellow]; Adoption_Bias[label="AI Bias Towards Popular Technologies (e.g., React, Tailwind)" shape=box];Lack_of_Adoption[label="Stifled Adoption of New Tech\n(due to AI Knowledge Gap)" shape=box];Feedback_Loop[label="Inverse Feedback Loop\n(Lack of AI Support → Lack of Material)" shape=box];Developer_Decision[label="Developers Choosing Tech Based on AI Support" shape=box]; AI_Influence[label="AI Models Influence Developer Decisions" shape=ellipse, color=lightblue];System_Prompt[label="System Prompts & Preferences (AI Instructions)" shape=ellipse, color=lightblue]; Test_Results[label="AI Test Results (Claude, ChatGPT, Gemini, DeepSeek)" shape=ellipse, color=lightgray];Tech_Variation[label="Variation in Technology Choices\n(React, Tailwind, Vanilla HTML/CSS/JS)" shape=box];Transparency[label="Need for AI Model Transparency\n(Tech Bias Disclosure)" shape=box, color=lightcoral]; Knowledge_Gap->Lack_of_Adoption[label="Stifles adoption"];Knowledge_Gap->Feedback_Loop[label="Creates feedback loop"];Feedback_Loop->Lack_of_Adoption[label="Exacerbates issue"];Feedback_Loop->Developer_Decision[label="AI’s influence on devs"]; AI_Impact->Knowledge_Gap;AI_Impact->System_Prompt_Influence; System_Prompt_Influence->Adoption_Bias;System_Prompt_Influence->Developer_Decision; Developer_Decision->Lack_of_Adoption[label="Leads to stalled tech adoption"]; Test_Results->Tech_Variation[label="Different AI models show varied preferences"]; Transparency->System_Prompt_Influence[label="Encourages AI bias transparency"];Transparency->Adoption_Bias[label="Improves awareness of biases"];}
OCR4all	https://www.ocr4all.org/	386	LorenDB	43043671	digraph OCR4all{node[shape=box, style=filled, fillcolor=lightblue, fontname="Helvetica"]; OCR4all[label="OCR4all\nOptical Character Recognition (and more) for everyone"]; FreeOpenSource[label="Fully Free and Open-Source\nNo subscriptions, paywalled features or private code"];Flexible[label="Flexible Applicability\nHigh-quality processing of manuscripts\nMass full-text recognition of printings"];Powerful[label="Powerful Layout and Text Annotation\nLAREX editor for manual annotation, correction, and comparison"];OCRDCompatible[label="OCR-D Compatible\nFuture versions fully compatible with the OCR-D ecosystem"];Usability[label="Designed with Usability in Mind\nCreate complex OCR workflows through UI"];CrossPlatform[label="Easy Cross-Platform Deployment\nDocker and a single command to run OCR4all"]; OCR4all->FreeOpenSource;OCR4all->Flexible;OCR4all->Powerful;OCR4all->OCRDCompatible;OCR4all->Usability;OCR4all->CrossPlatform;}
What if Eye...?	https://eyes.mit.edu/	379	smusamashah	43043063	digraph WhatIfEye{graph[rankdir=TB bgcolor="#ffffff"];node[shape=box style=filled fillcolor="#f0f0f0" fontname="Arial" fontsize=12 color="#333333" penwidth=1 margin="0.3,0.2"];edge[arrowhead=vee arrowsize=0.8 color="#555555" penwidth=1];WhatIfEye[label="What if Eye...?\nComputationally Recreating the Cambrian Explosion of Vision"];Emergence[label="Emergence of eyes from single light-sensitive photoreceptors"];Lenses[label="Why do eyes have lenses?"];ACI[label="Artificial Cambrian Intelligence:\nEvolve your own creatures in our simulator!"];Roadmap[label="A Roadmap for Generative Design of Visual Intelligence"];Exhibit[label="MIT Museum Exhibit After Dark Event:\nEvolving Animals Eyes in Virtual Reality!"];WhatIfEye->Emergence;WhatIfEye->Lenses;WhatIfEye->ACI;WhatIfEye->Roadmap;WhatIfEye->Exhibit;}
The OBS Project is threatening Fedora Linux with legal action	https://gitlab.com/fedora/sigs/flatpak/fedora-flatpaks/-/issues/39#note_2344970813	287	TheFreim	43042985	digraph Fedora_Flatpaks_Issue{node[shape=box, style=filled, fontname="Helvetica"];rankdir=LR;start[label="Start", fillcolor="#CCCCCC"];issue[label="Broken OBS Studio Flatpak", fillcolor="#FF9900"];unofficial_package[label="Unofficial OBS Studio Flatpak", fillcolor="#FFCCCC"];official_package[label="Official OBS Studio Flatpak", fillcolor="#CCFFCC"];gnome_software_issue[label="GNOME Software Issue #2754", fillcolor="#CCCCFF"];fedora_workstation_issue[label="Fedora Workstation Issue #463", fillcolor="#CCCCFF"];solution[label="Remove or Clarify Package", fillcolor="#99FF99"];explanation[label="Explanation for Package Overwrite", fillcolor="#FFFF99"];start->issue[label="Problem Statement"];issue->unofficial_package[label="Caused by"];unofficial_package->gnome_software_issue[label="Related Issue"];unofficial_package->fedora_workstation_issue[label="Related Issue"];issue->solution[label="Desired Solution"];issue->explanation[label="Needed Explanation"];official_package->solution[label="Comparison"];}
The New York Stock Exchange plans to launch NYSE Texas	https://ir.theice.com/press/news-details/2025/The-New-York-Stock-Exchange-to-Launch-NYSE-Texas/default.aspx	264	ChrisArchitect	43045558	digraph NYSE_Texas{rankdir=TB;node[shape=box, style="rounded,filled", fillcolor="#E0E0E0"]; NYSE[label="New York Stock Exchange", fillcolor="#FFD700"];ICE[label="Intercontinental Exchange, Inc.", fillcolor="#87CEEB"];NYSE_Texas[label="NYSE Texas", fillcolor="#32CD32"];Dallas[label="Headquartered in Dallas, Texas", fillcolor="#FFB6C1"];Companies[label="Companies Listing Opportunity", fillcolor="#FFDEAD"];Market_Leader[label="Texas: Market Leader\n- Largest number of NYSE listings\n- $3.7 trillion market value", fillcolor="#FFCC00"];Pro_Business[label="Pro-Business Atmosphere", fillcolor="#FFA07A"];Global_Reach[label="Global Listing Venue", fillcolor="#98FB98"]; NYSE->ICE[label="Part of"];ICE->NYSE_Texas[label="Plans to launch"];NYSE_Texas->Dallas;NYSE_Texas->Companies;NYSE_Texas->Market_Leader;NYSE_Texas->Pro_Business;NYSE_Texas->Global_Reach;Market_Leader->Pro_Business;Market_Leader->Companies;}
DA, sheriff, who shared woman's nude photos on phone are covered by QI	https://www.oregonlive.com/crime/2025/02/an-oregon-womans-nude-cellphone-photos-ended-up-the-talk-of-town-she-tracked-it-back-to-the-da.html	256	y33t	43049174	digraph G{rankdir=LR node[shape=box, style=filled, fillcolor="#E0E0E0", fontname="Arial", fontsize=10]edge[fontname="Arial", fontsize=9]subgraph cluster_0{label="Main Entities" style=dashed GrantCountyDA[label="Grant County District Attorney\nJim Carpenter"]HaleyOlson[label="Haley Olson\n(Oregon woman)"]GlennPalmer[label="Glenn Palmer\n(Grant County Sheriff)"]IdahoPolice[label="Idaho State Police"]JeromeCountyDA[label="Jerome County District Attorney"]} subgraph cluster_1{label="Legal Proceedings" style=dashed NinthCircuit[label="9th U.S. Circuit Court of Appeals\nRuling (2-1)"]QualifiedImmunity[label="Qualified Immunity"]FourthAmendment[label="Fourth Amendment Violation"]FourteenthAmendment[label="Fourteenth Amendment Violation"]}GrantCountyDA->HaleyOlson[label="Reviewed phone data\nwithout warrant"]GrantCountyDA->GlennPalmer[label="Shared findings\n(no evidence of misconduct)"]HaleyOlson->IdahoPolice[label="Consent to search phone"]IdahoPolice->JeromeCountyDA[label="Phone data shared with\nGrant County"]JeromeCountyDA->GrantCountyDA[label="Shared phone data\nfor 'internal purposes'"]GlennPalmer->IdahoPolice[label="Requested phone data", style=dotted]GlennPalmer->GrantCountyDA[label="Requested review of phone data"]HaleyOlson->NinthCircuit[label="Filed lawsuit\n(Fourth & Fourteenth Amendment)"]NinthCircuit->GrantCountyDA[label="Actions deemed\nunconstitutional", style=dotted]NinthCircuit->QualifiedImmunity[label="Granted to Carpenter"]NinthCircuit->FourthAmendment[label="Violation established"]NinthCircuit->FourteenthAmendment[label="Violation alleged"]NinthCircuit->HaleyOlson[label="No legal remedy\nprovided"]NinthCircuit->GlennPalmer[label="No supervisory liability"]HaleyOlson->GrantCountyDA[label="Alleged sharing of\nnude photos", style=dotted]HaleyOlson->GlennPalmer[label="Alleged gossip and\nphoto circulation", style=dotted]}
Does X cause Y? An in-depth evidence review (2021)	https://www.cold-takes.com/does-x-cause-y-an-in-depth-evidence-review/	224	l0b0	43045406	digraph G{rankdir=TB;node[shape=box, style=filled, fillcolor="#f0f8ff", fontname="Arial", fontsize=12];edge[color="#4682b4"];A[label="Does X Cause Y?"];B[label="Hundreds of Studies"];C[label="Simple Observational Studies"];D[label="Confounders (Z)"];E[label="Regression Analysis\n(Controlling for Z)"];F[label="1-5 Interesting Studies"];G[label="Complex Historical Events"];H[label="Replication Challenges"];I[label="Different Stories"];J[label="Unified Theory?\n(X causes Y under specific conditions)"];K[label="Conclusion:\nUnclear Relationship"];A->B[label="Research"];B->C[label="Mostly"];C->D[label="Issue"];C->E[label="Attempts to Control"];E->D[label="Relies on Assumptions"];B->F[label="Some"];F->G[label="Includes"];F->H[label="Challenges"];F->I[label="Conflicting Results"];I->J[label="Possibility"];J->K[label="Leads to"];K->A[label="Reassess"];subgraph cluster_0{style=dotted;color=lightgrey;label="Research Process";B;C;F;}subgraph cluster_1{style=dotted;color=lightgrey;label="Challenges & Considerations";D;E;H;I;}}
Extensible WASM Applications with Go	https://go.dev/blog/wasmexport	217	ingve	43045698	digraph Go_Wasm_Enhancements{rankdir=TB;node[shape=rect, style=filled, fillcolor="#f0f0f0", fontsize=10, fontname="Arial"];Go_1_24[label="Go 1.24 Enhancements\n- go:wasmexport directive\n- Build WASI reactor", fillcolor="#cfe2f3"];WebAssembly[label="WebAssembly (Wasm)\n- Binary instruction format\n- High-performance execution", fillcolor="#c9daf8"];WASI[label="WebAssembly System Interface (WASI)\n- System call API\n- Interacts with system resources", fillcolor="#c9daf8"];Wasm_Hosts[label="Wasm Hosts\n- Better integration\n- Go-based Wasm applications", fillcolor="#c9daf8"];Reactor_Building[label="Building WASI Reactor\n- Continuous operation\n- Multiple function calls", fillcolor="#f4cccc"];Rich_Types[label="Supporting Rich Types\n- Relaxed type constraints\n- Ergonomic Go Wasm apps", fillcolor="#f9cb9c"];Limitations[label="Limitations\n- Single-threaded\n- Type restrictions", fillcolor="#f4cccc"];Conclusion[label="Conclusion\n- Significant step forward\n- New possibilities for Go in Wasm", fillcolor="#d9ead3"];Go_1_24->WebAssembly[label="Enhances capabilities"];Go_1_24->WASI[label="Builds reactor"];Go_1_24->Wasm_Hosts[label="Exports Go functions"];Go_1_24->Reactor_Building;Go_1_24->Rich_Types;Go_1_24->Limitations;Go_1_24->Conclusion;}
