title	url	points	by	hnId	dot
Netlify just sent me a $104k bill for a simple static site	https://old.reddit.com/r/webdev/comments/1b14bty/netlify_just_sent_me_a_104k_bill_for_a_simple/	1567	laubonghaudoi	39520776	digraph RedditBlock{rankdir=LR;node[shape=box];Start[label="Blocked Request"];Policy[label="Network Policy"];Login[label="Log in or Create Account"];Developer[label="Register or Sign In with Developer Credentials"];UserAgent[label="Check User-Agent"];DefaultUA[label="Change User-Agent to Default"];Terms[label="Read Terms of Service"];Appeal[label="File a Ticket if Incorrectly Blocked"];Contact[label="Contact Support"];IPAddress[label="Include IP Address"];RedditAccount[label="Include Reddit Account"];Start->Policy;Policy->Login[label="Try this"];Policy->Developer[label="If using a script"];Developer->UserAgent;UserAgent->DefaultUA;Policy->Terms;Policy->Appeal;Appeal->Contact;Contact->IPAddress;Contact->RedditAccount;}
Airfoil	https://ciechanow.ski/airfoil/	1442	todsacerdoti	39526057	digraph AirfoilPhysics{rankdir=LR;node[shape=box, style=filled, fillcolor=lightblue];Airfoil[label="Airfoil" fillcolor=lightyellow];Forces[label="Forces of Flight" fillcolor=lightgreen];Lift[label="Lift" fillcolor=lightgreen];Drag[label="Drag" fillcolor=lightgreen];Pressure[label="Pressure" fillcolor=lightgreen];Velocity[label="Velocity" fillcolor=lightgreen];VisualizeFlow[label="Visualizing Flow" fillcolor=lightcoral];Arrows[label="Arrows for Direction & Speed" fillcolor=lightpink];Markers[label="Markers for Air Movement" fillcolor=lightpink];ColorGradient[label="Color Gradient for Speed" fillcolor=lightpink];Airflow[label="Airflow Dynamics" fillcolor=lightgrey];BoundaryLayer[label="Boundary Layer" fillcolor=lightgrey];Viscosity[label="Viscosity" fillcolor=lightgrey];ReynoldsNumber[label="Reynolds Number" fillcolor=lightgrey];Airfoil->Forces;Forces->Lift;Forces->Drag;Forces->Pressure;Forces->Velocity;VisualizeFlow->Arrows;VisualizeFlow->Markers;VisualizeFlow->ColorGradient;Airflow->BoundaryLayer;Airflow->Viscosity;Airflow->ReynoldsNumber;Airfoil->VisualizeFlow;Airfoil->Airflow;}
Apple cancels work on electric car, shifts team to generative AI	https://www.bloomberg.com/news/articles/2024-02-27/apple-cancels-work-on-electric-car-shifts-team-to-generative-ai	580	coloneltcb	39528134	digraph AppleCarProject{rankdir=TB; A[label="Apple's Electric Car Project (Titan)", shape=box, style=filled, fillcolor=lightblue];B[label="Decade-long Effort", shape=ellipse];C[label="Project Abandoned", shape=ellipse, style=filled, fillcolor=lightcoral];D[label="Team Shifted to AI Division", shape=ellipse];A->B;A->C;A->D;E[label="Announcement Date: Feb 27, 2024", shape=plaintext];F[label="Executives: Jeff Williams, Kevin Lynch", shape=plaintext];G[label="Surprised 2,000 Employees", shape=plaintext];A->E;A->F;A->G;}
I turned my open-source project into a full-time business	https://docs.emailengine.app/how-i-turned-my-open-source-project-into/	544	andris9	39522348	digraph EmailEngineJourney{rankdir=TB;node[shape=box];Start[label="Started with Open-Source Software\n(15 years ago)\n- Used permissive licenses (MIT, BSD)\n- Aimed for maximum reach"]; Nodemailer[label="Developed Nodemailer\n- Major success with many users\n- Rejected donations to maintain fairness"]; Reflection[label="Reflected on missed opportunities\n- Startup using Nodemailer was acquired\n- No compensation received"]; NewStart[label="Started EmailEngine\n- Released under AGPL license\n- Implemented Contributor License Agreements (CLA)"]; InitialBusinessModel[label="Initial Business Model\n- Offered AGPL version and MIT version for subscribers\n- Only gained few paying subscribers"]; BusinessPivot[label="Pivoted Business Model\n- Redesigned UI\n- Introduced license key system\n- Changed license from AGPL to commercial"]; Growth[label="Growth in Revenue\n- Initial revenue: 750€ in 1.5 years\n- First month after pivot: 1750€\n- Current MRR: 6100€"]; Regret[label="Regret\n- Wish had started selling software earlier\n- Selling to businesses more reliable than donations"];Start->Nodemailer;Nodemailer->Reflection;Reflection->NewStart;NewStart->InitialBusinessModel;InitialBusinessModel->BusinessPivot;BusinessPivot->Growth;Growth->Regret;subgraph cluster_notes{label="Key Takeaways";style=dashed;node[shape=ellipse];Note1[label="Open-source can be limiting\nif not monetized properly"];Note2[label="CLAs can deter some contributors"];Note3[label="Commercial licensing can lead to\nsignificant revenue growth"];Note4[label="Smaller tools can still promote larger projects"];} Growth->Note1;Growth->Note2;Growth->Note3;Growth->Note4;}
Nintendo is suing the creators of Switch emulator Yuzu	https://overkill.wtf/nintendo-sue-yuzu-emulator/	482	brandrick	39530203	digraph Nintendo_vs_Yuzu{rankdir=TB;node[shape=rectangle, style=filled, fillcolor=lightgrey, fontname="Arial"]; Nintendo[label="Nintendo of America"];YuzuCreators[label="Yuzu Emulator Creators\n(Tropic Haze LLC)"];Lawsuit[label="Lawsuit"];PiracyClaim[label="Facilitating Piracy Claim"];DMCA[label="DMCA Infringement\n(Copyright Circumvention)"];Damages[label="Seeking Damages\n& Shutdown"];Patreon[label="Yuzu's Patreon\n(7000+ Members, $30k/month)"]; Nintendo->Lawsuit[label="Files"];Lawsuit->YuzuCreators[label="Against"];Lawsuit->PiracyClaim[label="Claims"];PiracyClaim->DMCA[label="Under"];Lawsuit->Damages[label="Demands"];YuzuCreators->Patreon[label="Supported By"];Patreon->PiracyClaim[label="Promotes"];}
Boeing missing key elements of safety culture: FAA report	https://www.ainonline.com/aviation-news/air-transport/2024-02-26/boeing-missing-key-elements-safety-culture-faa-report	335	elorant	39523813	digraph SafetyEvents{rankdir=LR;node[shape=rectangle, style=filled, fillcolor=lightblue, fontname="Arial", fontsize=12];AINsight[label="AINsight: FOD for Thought\n- Foreign objects cause aircraft incidents", shape=box];RunwayExcursions[label="Standards & Training\n- Wet runways cause excursions", shape=box];Communication[label="Communication in Multi-generational Workforce\n- Key to Safety", shape=box];SafetySymposium[label="Next ACSF Safety Symposium\n- Discuss emerging safety challenges", shape=box];SafetyCaseStudy[label="Ferraro's Safety Case Study\n- Preventing aviation mishaps", shape=box];SafetyCulture[label="Michael Graham on Safety Culture\n- Influence shapes culture in aviation", shape=box];Hypervigilance[label="Hypervigilance & Right Influence\n- Importance in safety environment", shape=box];SafetyInfluencers[label="Bombardier Safety Standdown\n- Promoting safety influencers", shape=box];AINsight->RunwayExcursions;RunwayExcursions->Communication;Communication->SafetySymposium;SafetySymposium->SafetyCaseStudy;SafetyCaseStudy->SafetyCulture;SafetyCulture->Hypervigilance;Hypervigilance->SafetyInfluencers;}
Botanical gardens can cool city air by an average of 5°C	https://newatlas.com/environment/surrey-cooling-effects-green-spaces-waterways/	330	Brajeshwar	39524164	digraph CoolingEffects{node[shape=rectangle, style=filled, color=lightblue];ClimateChange[label="Climate Change\nWarming the Planet"];UrbanInfrastructure[label="Urban Infrastructure\nPlanning"];BotanicalGardens[label="Botanical Gardens\nCooling: 5 °C"];Wetlands[label="Wetlands\nCooling: 4.7 °C"];RainGardens[label="Rain Gardens\nCooling: 4.5 °C"];StreetTrees[label="Street Trees\nCooling: 3.8 °C"];CityParks[label="City Parks\nCooling: 3.2 °C"];CoolingEffects[label="Cooling Effects\nof Green Spaces"];ClimateChange->UrbanInfrastructure;UrbanInfrastructure->BotanicalGardens;UrbanInfrastructure->Wetlands;UrbanInfrastructure->RainGardens;UrbanInfrastructure->StreetTrees;UrbanInfrastructure->CityParks; BotanicalGardens->CoolingEffects;Wetlands->CoolingEffects;RainGardens->CoolingEffects;StreetTrees->CoolingEffects;CityParks->CoolingEffects;CoolingBenefits[label="Benefits:\nShade, Evapotranspiration,\nAlbedo Effect"];CoolingEffects->CoolingBenefits;}
Testing the F-35C Tailhook	https://the-engi-nerd.github.io/posts/welcome/	315	sklargh	39525243	digraph G{rankdir=LR;node[shape=box, style="rounded,filled", fillcolor=white];edge[dir="forward"];"F-35C Tailhook Issues"[fillcolor="#E6E6FA"];"Initial Testing at Lakehurst NAS"->"F-35C Tailhook Design Flaw"[label=" Discovery"];"F-35C Tailhook Design Flaw"->"Wire Dynamics Model Error"[label="Cause"];"Wire Dynamics Model Error"->"Hook Skipping Over Wire"[label="Effect"];"Hook Skipping Over Wire"->"Damage to Instrumentation"[label="Consequence"];"Damage to Instrumentation"->"Redesign of Hook"[label="Response"];"Redesign of Hook"->"New Hook Features"[label="Implement"];"New Hook Features"->"Improved Hook Performance"[label="Result"];"Improved Hook Performance"->"Bearing and Pin Issues"[label="New Challenge"];"Bearing and Pin Issues"->"Maintenance and Repair"[label="Action"];"Maintenance and Repair"->"Off-Center Arrestment Tests"[label="Continued Testing"];"Off-Center Arrestment Tests"->"Steep Landing Incident"[label="Complication"];"Steep Landing Incident"->"End of Tailhook Tests"[label="Conclusion"];subgraph cluster_0{style=filled;color=lightgrey;node[style=filled,color=white];"New Hook Features"->"Stronger Hold Down Damper";"New Hook Features"->"Upstroke Damper";"New Hook Features"->"Lateral Limiter";"New Hook Features"->"New Hook Shoe";label="Hook Redesign Components";}"Program Note: Engineer's Departure and Return"[fillcolor="#FFFACD", shape=note];}
Rapier is a set of 2D and 3D physics engines written in Rust	https://rapier.rs/docs/	309	excsn	39519894	digraph Rapier{node[shape=box, style=filled, fillcolor="#E0E0E0"]; Rapier[label="Rapier\n(2D & 3D Physics Engine)\nWritten in Rust" shape=ellipse fillcolor="#B0C4DE"]; RigidBodyCollisions[label="Rigid-body Collisions & Forces"];JointConstraints[label="Joint Constraints"];ContactEvents[label="Contact Events & Sensors"];Snapshotting[label="Snapshotting"];CrossPlatformDeterminism[label="Optional Cross-Platform Determinism"];JavaScriptBindings[label="JavaScript Bindings"];MoreFeatures[label="And More..."]; OpenSource[label="Free & Open-Source\n(Apache 2.0 License)"];DevelopedBy[label="Developed by Dimforge\n(open-source company)"];Support[label="Support us on GitHub Sponsor"]; Rapier->RigidBodyCollisions;Rapier->JointConstraints;Rapier->ContactEvents;Rapier->Snapshotting;Rapier->CrossPlatformDeterminism;Rapier->JavaScriptBindings;Rapier->MoreFeatures; Rapier->OpenSource;OpenSource->DevelopedBy;DevelopedBy->Support;}
Why time seems to pass faster as we age	https://invertedpassion.com/why-time-seems-to-pass-faster-as-we-age/	290	paraschopra	39522249	digraph TimePerception{node[shape=box, style=rounded, fontname="Arial", fontsize=10];A[label="Time Perception Changes with Age"];B[label="Brain as a Prediction Device"];C[label="Predictability and Memory"];D[label="Childhood vs. Adulthood"];E[label="Impact of Predictability"];F[label="Strategies to Slow Down Time"];G[label="Existential Crisis"];H[label="Call to Action"];A->B[label="Evolutionary Efficiency"];B->C[label="Model World for Survival"];C->D[label="Memory Efficiency"];D->E[label="Less Surprising Events"];E->F[label="Break Predictability"];F->G[label="Explore Unknown"];G->H[label="Radical Changes Needed"];A[label="Time Perception Changes with Age"];B[label="Brain as a Prediction Device"];C[label="Predictability and Memory"];D[label="Childhood vs. Adulthood"];E[label="Impact of Predictability"];F[label="Strategies to Slow Down Time"];G[label="Existential Crisis"];H[label="Call to Action"];A->B[label="Evolutionary Efficiency"];B->C[label="Model World for Survival"];C->D[label="Memory Efficiency"];D->E[label="Less Surprising Events"];E->F[label="Break Predictability"];F->G[label="Explore Unknown"];G->H[label="Radical Changes Needed"];subgraph cluster_0{label="Understanding Time Perception";style=dashed;A;B;C;}subgraph cluster_1{label="Life Stages and Memory";style=dashed;D;E;}subgraph cluster_2{label="Solutions and Actions";style=dashed;F;G;H;}}
