title	url	points	by	hnId	dot
OpenAI used Kenyan workers on less than $2 per hour to make ChatGPT less toxic	https://time.com/6247678/openai-chatgpt-kenya-workers/	415	mkeeter	34426421	digraph ChatGPT_Story{rankdir=TB;node[shape=box, style="filled", fillcolor="#E6E6FA", fontsize=12];subgraph cluster_1{label="ChatGPT Overview";ChatGPT[label="ChatGPT\n- Launched in Nov 2022\n- Over 1M users in a week\n- Created by OpenAI", shape=ellipse, fillcolor="#D8BFD8"];OpenAI[label="OpenAI\n- Valuation: $29B\n- Talks with Microsoft\n- Founded in 2015", shape=ellipse, fillcolor="#D8BFD8"];}subgraph cluster_2{label="Data Labeling Process";Sama[label="Sama\n- Outsourced labor in Kenya\n- Paid $1.32-$2/hr\n- Tasked with labeling toxic content", shape=ellipse, fillcolor="#D8BFD8"];Toxicity[label="Toxicity Issues\n- AI trained on internet data\n- Issues with violence, hate, abuse", shape=ellipse, fillcolor="#D8BFD8"];Labels[label="Labeling\n- Labeled examples for AI\n- Included graphic content", shape=ellipse, fillcolor="#D8BFD8"];Safety[label="Safety Mechanism\n- AI filters toxic content\n- Built into ChatGPT", shape=ellipse, fillcolor="#D8BFD8"];}subgraph cluster_3{label="Ethical Concerns";Conditions[label="Working Conditions\n- Precarious labor\n- Mental health issues", shape=ellipse, fillcolor="#D8BFD8"];Exploitation[label="Exploitation\n- Hidden labor in Global South\n- Low wages for high-stress work", shape=ellipse, fillcolor="#D8BFD8"];}subgraph cluster_4{label="Collapse of Relationship";Cancelation[label="Contract Cancelation\n- Due to graphic content\n- Impact on workers' livelihoods", shape=ellipse, fillcolor="#D8BFD8"];PR_Fallout[label="PR Fallout\n- Negative media attention\n- Shift in company strategy", shape=ellipse, fillcolor="#D8BFD8"];}ChatGPT->OpenAI;OpenAI->Sama;OpenAI->Toxicity;Toxicity->Labels;Labels->Safety;Safety->Conditions;Conditions->Exploitation;Cancelation->PR_Fallout;}
Bitwarden Acquires Passwordless.dev	https://bitwarden.com/blog/bitwarden-extends-passwordless-leadership-with-acquisition/	408	xxkylexx	34427553	digraph BitwardenPasswordless{rankdir=TB;node[shape=box, style=filled, color=lightblue];A[label="Bitwarden Acquisition of Passwordless.dev" shape=ellipse];B[label="Significant Milestone" shape=ellipse];C[label="Passwordless.dev Overview" shape=box];D[label="API Framework for Developers" shape=box];E[label="FIDO2 WebAuthn Features" shape=box];F[label="Improved Digital Security" shape=box];G[label="Accelerates Enterprise Security Transformation" shape=box];H[label="Bitwarden Passwordless.dev Beta Program" shape=box];I[label="Passwordless Features in Bitwarden" shape=box];J[label="Benefits of Acquisition" shape=box];K[label="Future Innovations and Developments" shape=box];A->B;A->C;C->D;C->E;C->F;C->G;A->H;A->I;A->J;A->K;D->"Minimizes Complexity for Developers";E->"Face ID, Fingerprint, Windows Hello";F->"Eradicates Phishing Attacks";G->"Quick Integration for Enterprises";H->"Opportunity for Testing and Feedback";I->"Biometric Logins, Security Keys, Passkey Support";J->"Accessibility of Passwordless Technologies";K->"Integration into Bitwarden Portfolio";}
No Start Menu for You	https://randomascii.wordpress.com/2023/01/17/no-start-menu-for-you/	404	jabagawee	34423557	digraph{rankdir=LR;"No Start Menu for You"->"Analysis of the problem";"Analysis of the problem"->"SearchApp gains focus but waits";"SearchApp gains focus but waits"->"CPU and disk are idle";"CPU and disk are idle"->"WerFault.exe and wermgr.exe get busy";"WerFault.exe and wermgr.exe get busy"->"RuntimeBroker.exe crashes";"RuntimeBroker.exe crashes"->"WerFault.exe deals with the crash";"WerFault.exe deals with the crash"->"New RuntimeBroker.exe launches";"New RuntimeBroker.exe launches"->"WerFault.exe waiting in UploadReport";"WerFault.exe waiting in UploadReport"->"Heap corruption in RuntimeBroker.exe";"Heap corruption in RuntimeBroker.exe"->"Watching for this problem";"Watching for this problem"->"Waiting on upload";"Waiting on upload"->"Fixing the crash";"Fixing the crash"->"Conclusions";"Conclusions"->"Online discussion";}
Thonny â€“ Python IDE for beginners	https://thonny.org	364	ankit70	34424854	digraph Thonny{rankdir=TB;node[shape=box, style=filled, fillcolor=lightblue];Thonny[label="Thonny 4\nPython IDE for Beginners\nðŸ‡ºðŸ‡¦ Support Ukraine ðŸ‡ºðŸ‡¦", shape=ellipse, fillcolor=lightgreen]; Features[label="Features", shape=rect, fillcolor=lightyellow];Easy_Start[label="Easy to Get Started\nPython 3.10 Built-in"];No_Hassle[label="No-hassle Variables\nView â†’ Variables"];Simple_Debugger[label="Simple Debugger\nCtrl+F5 for Step-by-Step"];Expr_Eval[label="Step Through Expression Evaluation"];Func_Calls[label="Faithful Representation of Function Calls"];Syntax_Errors[label="Highlights Syntax Errors"];Explains_Scopes[label="Explains Scopes"];Ref_Model[label="Mode for Explaining References"];Code_Completion[label="Code Completion"];Beginner_Shell[label="Beginner Friendly System Shell"];Pip_GUI[label="Simple and Clean pip GUI"];Development[label="Development\n2014-2018: University of Tartu\nSupported by Cybernetica AS\nRaspberry Pi Foundation"]; Instructions[label="Instructions & Downloads\nInstallation for Windows/Mac/Linux\npip install thonny"];Plugins[label="Plug-ins\nExtensible Infrastructure"]; Thonny->Features;Features->Easy_Start;Features->No_Hassle;Features->Simple_Debugger;Features->Expr_Eval;Features->Func_Calls;Features->Syntax_Errors;Features->Explains_Scopes;Features->Ref_Model;Features->Code_Completion;Features->Beginner_Shell;Features->Pip_GUI;Thonny->Development;Thonny->Instructions;Thonny->Plugins;}
U.S. military-run slot machines earn $100M a year from service members	https://www.npr.org/2022/07/31/1110882487/dod-slot-machines-overseas-bases	359	geox	34429502	digraph MilitaryGambling{rankdir=LR;node[shape=box, style="rounded,filled", fontsize=12, fontcolor=white, fillcolor=blue];subgraph cluster_0{label="Military Gambling Overview";style=dashed;color=lightgray;MilitaryBases[label="U.S. Military Bases\n(3,000+ Slot Machines)"];ProblemGambling[label="Problem Gamblers\n(2x National Avg.)"];MoraleWelfare[label="Revenue\n($100M/year)"];Isolation[label="Isolation of Service Members"];Legislation[label="Legislative Attempts\n(2018, Warren & Daines)"];}subgraph cluster_1{label="Issues & Concerns";style=dashed;color=lightgray;GamblingAddiction[label="Gambling Addiction Risks"];LackOfOversight[label="Limited Regulation"];SuicideRisk[label="Suicide Cases\n(Due to Gambling)"];}subgraph cluster_2{label="Historical Context";style=dashed;color=lightgray;SlotMachinesHistory[label="Slot Machines History\n(1951 Ban, 1980s Restoration)"];MWRManagement[label="MWR Management\n(Programs for Resilience)"];}MilitaryBases->ProblemGambling;MilitaryBases->MoraleWelfare;MilitaryBases->Isolation;ProblemGambling->GamblingAddiction;GamblingAddiction->SuicideRisk;LackOfOversight->GamblingAddiction;SlotMachinesHistory->MWRManagement;Legislation->LackOfOversight;}
LangChain: Build AI apps with LLMs through composability	https://github.com/hwchase17/langchain	344	azhenley	34422627	digraph LangChain{rankdir=TB;node[shape=box, style="rounded,filled", fillcolor="#E0F7FA", fontcolor="#004D40"]; LangChain[label="LangChain\nBuild context-aware reasoning applications" shape=ellipse fillcolor="#B2EBF2"]; subgraph cluster_components{label="Core Components";style=dashed;color="#00796B"; Libraries[label="Open-source Libraries"];Productionization[label="Productionization"];Deployment[label="Deployment"];} subgraph cluster_features{label="Features";style=dashed;color="#00796B"; Components[label="Components"];EasyOrchestration[label="Easy Orchestration with LangGraph"];} subgraph cluster_use_cases{label="Use Cases";style=dashed;color="#00796B"; QuestionAnswering[label="â“ Question Answering with RAG"];ExtractingOutput[label="ðŸ§± Extracting Structured Output"];Chatbots[label="ðŸ¤– Chatbots"];} LangChain->Libraries;LangChain->Productionization;LangChain->Deployment; LangChain->Components;LangChain->EasyOrchestration; LangChain->QuestionAnswering;LangChain->ExtractingOutput;LangChain->Chatbots;}
Rust concepts I wish I learned earlier	https://rauljordan.com/rust-concepts-i-wish-i-learned-earlier/	328	rck	34427604	digraph{"Rust"->"Memory-safe" "Rust"->"Modern programs" "Rust"->"Systems programming" "Rust"->"Difficult to learn" "Rust"->"Popular in surveys" "Rust"->"Linux kernel" "Rust"->"References" "References"->"Shared reference" "References"->"Mutable reference" "Rust"->"Bidirectional references" "Rust"->"Deref" "Rust"->"Interior mutability" "Rust"->"Get and get mut methods" "Rust"->"Unsafe code" "Rust"->"Impl types" "Rust"->"Iterators" "Rust"->"Phantom data" "Rust"->"Rayon for parallelism" "Rust"->"Extension traits" "Rust"->"Option and Result types" "Rust"->"Drop trait" "Rust"->"Immutable data structures" "Rust"->"Blanket traits" "Rust"->"Match statements" "Rust"->"Core asm" "Rust"->"Criterion for benchmarking" "Learning Rust"->"Tutorials" "Learning Rust"->"Real programs" "Learning Rust"->"Bumps in the road" "Learning Rust"->"Tips for learning" "Rust"->"Java/C++" "Rust"->"Go" "Rust"->"Haskell/OCaml"}
Microsoft to lay off 10k workers	https://blogs.microsoft.com/blog/2023/01/18/subject-focusing-on-our-short-and-long-term-opportunity/	326	dola	34427055	digraph MicrosoftOpportunity{node[shape=box, style=rounded, fontsize=12, fontname="Arial"]; rankdir=TB;bgcolor="#f3f4f6";Subject[label="Focusing on Short- & Long-Term Opportunities" shape=ellipse style=filled color="#0078d4" fontcolor=white];A[label="1. Align Cost Structure with Revenue" shape=box style=filled color="#e7f3ff"];B[label="2. Invest in Strategic Areas" shape=box style=filled color="#e7f3ff"];C[label="3. Treat People with Dignity & Respect" shape=box style=filled color="#e7f3ff"];Subject->A;Subject->B;Subject->C;A1[label="Reduce Workforce by 10,000" shape=box style=filled color="#ffffff"];A2[label="Focus on Key Strategic Areas" shape=box style=filled color="#ffffff"]; B1[label="Allocate Capital for Growth" shape=box style=filled color="#ffffff"];B2[label="Divest from Non-Strategic Areas" shape=box style=filled color="#ffffff"]; C1[label="Provide Above-Market Severance" shape=box style=filled color="#ffffff"];C2[label="Career Transition Services" shape=box style=filled color="#ffffff"];A->A1;A->A2; B->B1;B->B2;C->C1;C->C2;}
Why to start a startup in a bad economy (2008)	http://paulgraham.com/badeconomy.html	274	dbrereton	34429869	digraph{"Main Idea"->"Recession may not be bad time to start startup";"Recession may not be bad time to start startup"->"Success or failure based on founders";"Success or failure based on founders"->"Who you are matters more than economy";"Who you are matters more than economy"->"Think more about co - founder than economy";"Who you are matters more than economy"->"Act on idea now";"Act on idea now"->"Customers may benefit from recession";"Act on idea now"->"Investors are reluctant in bad times";"Investors are reluctant in bad times"->"Adapt to investors' whims";"Adapt to investors' whims"->"Run startup cheaply";"Run startup cheaply"->"Recession - proof startup";"Recession - proof startup"->"Less competition in bad times";"Less competition in bad times"->"Time to act is now";"Investors are reluctant in bad times"->"Founders also reluctant in bad times";}
Bank of America has lost Zelle transfers for many customers	https://old.reddit.com/r/personalfinance/comments/10f8042/bank_of_america_just_lost_all_zelle_transfers_for/	255	ndiddy	34429298	digraph BankOfAmericaZelleIssue{rankdir=TB;node[shape=box, style=filled, color=lightblue];"Bank of America"->"Zelle Transfers Disappeared"[label="many customers", color=red];"Zelle Transfers Disappeared"->"Accounts Show Negative Balance"[color=red];"Accounts Show Negative Balance"->"Overdraft Fees Incurred"[color=red];"Overdraft Fees Incurred"->"Customer Service Unreachable"[color=red];"Customer Service Unreachable"->"Downdetector Reports"[label="multiple reports", color=red];"Downdetector Reports"->"Reddit Post"[label="alert spread", color=blue];"Reddit Post"->"Community Response"[label="concern and advice", color=blue];"Community Response"->"File Complaints"[label="with OCC, FDIC, CFPB", color=green];"Community Response"->"Consider Switching Banks"[label="credit unions recommended", color=green];"Community Response"->"Check Transaction Histories"[label="document for proof", color=green];"Bank of America"->"Technical Glitch"[label="likely cause", color=orange];"Technical Glitch"->"Issue Resolved"[label="pending fix", color=orange];"Issue Resolved"->"Transactions Reappear"[color=green];"Transactions Reappear"->"Refund Overdraft Fees"[label="if applicable", color=green];}
